{
  "schema_version": 2,
  "revision": 0,
  "server_id": "",
  "active": {
    "default": "current"
  },
  "default_scene": "",
  "scenes": [
    {
      "id": "current",
      "name": "From the studio",
      "tags": [],
      "layers_by_role": {
        "strip.main": [
          {
            "id": "21810e09",
            "name": "Lows",
            "effect": {
              "id": "audio-visualizer",
              "version": "1.0.0"
            },
            "params": {
              "freq_lo": 30.0,
              "freq_hi": 150.0,
              "trigger": "level",
              "beats": 1,
              "threshold": -60.0,
              "ceiling": -25.0,
              "gain": 1.0,
              "curve": 1.0,
              "attack": 15.0,
              "release": 200.0,
              "floor": 0.0,
              "mode": "fill",
              "direction": "forward",
              "speed": 120.0,
              "width": 20.0,
              "peak": false,
              "palette": [
                "#FFFFFF"
              ]
            },
            "region": {
              "kind": "cells",
              "start": 0,
              "end": 99
            },
            "blend": "max",
            "axis": "linear_x",
            "enabled": true,
            "solo": false,
            "lane": -1
          },
          {
            "id": "twin",
            "name": "Segment",
            "effect": {
              "id": "audio-visualizer",
              "version": "1.0.0"
            },
            "params": {
              "freq_lo": 60.0,
              "freq_hi": 250.0,
              "trigger": "hits",
              "beats": 1,
              "threshold": 3.0,
              "ceiling": 10.0,
              "gain": 1.0,
              "curve": 1.0,
              "attack": 15.0,
              "release": 200.0,
              "floor": 0.0,
              "mode": "fill",
              "direction": "forward",
              "speed": 120.0,
              "width": 20.0,
              "peak": false,
              "palette": [
                "#FFFFFF"
              ]
            },
            "region": {
              "kind": "cells",
              "start": 100,
              "end": 199
            },
            "blend": "max",
            "axis": "linear_x",
            "enabled": true,
            "solo": false,
            "lane": -1
          },
          {
            "id": "d7dedaeb",
            "name": "Segment",
            "effect": {
              "id": "audio-visualizer",
              "version": "1.0.0"
            },
            "params": {
              "freq_lo": 60.0,
              "freq_hi": 250.0,
              "trigger": "level",
              "beats": 1,
              "threshold": -60.0,
              "ceiling": -25.0,
              "gain": 1.0,
              "curve": 1.0,
              "attack": 15.0,
              "release": 200.0,
              "floor": 0.0,
              "mode": "fill",
              "direction": "forward",
              "speed": 120.0,
              "width": 20.0,
              "peak": false,
              "palette": [
                "#FFFFFF"
              ]
            },
            "region": {
              "kind": "cells",
              "start": 50,
              "end": 60
            },
            "blend": "max",
            "axis": "linear_x",
            "enabled": true,
            "solo": false,
            "lane": -1
          }
        ]
      },
      "macros": []
    }
  ]
}
